[
  {
    "id": "desktop.numlock-on-startup",
    "title": "Num Lock activado al iniciar sesión",
    "description": "InitialKeyboardIndicators=2 en HKCU.",
    "category": "desktop",
    "risk": "LOW",
    "evidence": "STRONG",
    "evidenceRefs": [],
    "minBuild": 22000,
    "editions": [
      "*"
    ],
    "profiles": [
      "balanced",
      "developer",
      "gaming"
    ],
    "requires": [],
    "conflicts": [],
    "requiresReboot": false,
    "affectsSecurity": false,
    "affectsUpdates": false,
    "affectsCompatibility": false,
    "detect": {
      "kind": "registry",
      "hive": "HKCU",
      "path": "Control Panel\\Keyboard",
      "name": "InitialKeyboardIndicators",
      "valueKind": "String",
      "defaultIfAbsent": "0"
    },
    "desired": {
      "equals": "2"
    },
    "ops": [
      {
        "kind": "registry",
        "hive": "HKCU",
        "path": "Control Panel\\Keyboard",
        "name": "InitialKeyboardIndicators",
        "valueKind": "String",
        "value": "2"
      }
    ]
  },
  {
    "id": "desktop.scrollbars-always",
    "title": "Barras de desplazamiento siempre visibles",
    "description": "DynamicScrollbars=0. Útil en escritorio / productividad.",
    "category": "desktop",
    "risk": "LOW",
    "evidence": "STRONG",
    "evidenceRefs": [],
    "minBuild": 22000,
    "editions": [
      "*"
    ],
    "profiles": [
      "balanced",
      "developer"
    ],
    "requires": [],
    "conflicts": [],
    "requiresReboot": false,
    "affectsSecurity": false,
    "affectsUpdates": false,
    "affectsCompatibility": false,
    "detect": {
      "kind": "registry",
      "hive": "HKCU",
      "path": "Control Panel\\Accessibility",
      "name": "DynamicScrollbars",
      "valueKind": "DWord",
      "defaultIfAbsent": 1
    },
    "desired": {
      "equals": 0
    },
    "ops": [
      {
        "kind": "registry",
        "hive": "HKCU",
        "path": "Control Panel\\Accessibility",
        "name": "DynamicScrollbars",
        "valueKind": "DWord",
        "value": "0"
      }
    ]
  },
  {
    "id": "desktop.battery-percentage",
    "title": "Mostrar porcentaje de batería en la bandeja",
    "description": "IsBatteryPercentageEnabled=1. En sobremesa sin batería no cambia nada útil.",
    "category": "desktop",
    "risk": "LOW",
    "evidence": "STRONG",
    "evidenceRefs": [],
    "minBuild": 22000,
    "editions": [
      "*"
    ],
    "profiles": [
      "balanced",
      "developer",
      "gaming"
    ],
    "requires": [],
    "conflicts": [],
    "requiresReboot": false,
    "affectsSecurity": false,
    "affectsUpdates": false,
    "affectsCompatibility": false,
    "detect": {
      "kind": "registry",
      "hive": "HKCU",
      "path": "Software\\Microsoft\\Windows\\CurrentVersion\\Explorer\\Advanced",
      "name": "IsBatteryPercentageEnabled",
      "valueKind": "DWord",
      "defaultIfAbsent": 0
    },
    "desired": {
      "equals": 1
    },
    "ops": [
      {
        "kind": "registry",
        "hive": "HKCU",
        "path": "Software\\Microsoft\\Windows\\CurrentVersion\\Explorer\\Advanced",
        "name": "IsBatteryPercentageEnabled",
        "valueKind": "DWord",
        "value": "1"
      }
    ]
  }
]
