[
  {
    "id": "taskbar.search-icon",
    "title": "Buscar de la barra: solo icono",
    "description": "SearchboxTaskbarMode=1 muestra el icono de búsqueda, no el cuadro.",
    "category": "taskbar",
    "risk": "LOW",
    "evidence": "STRONG",
    "evidenceRefs": [],
    "minBuild": 22000,
    "editions": [
      "*"
    ],
    "profiles": [
      "balanced",
      "gaming"
    ],
    "requires": [],
    "conflicts": [],
    "requiresReboot": false,
    "affectsSecurity": false,
    "affectsUpdates": false,
    "affectsCompatibility": false,
    "detect": {
      "kind": "registry",
      "hive": "HKCU",
      "path": "Software\\Microsoft\\Windows\\CurrentVersion\\Search",
      "name": "SearchboxTaskbarMode",
      "valueKind": "DWord",
      "defaultIfAbsent": 1
    },
    "desired": {
      "equals": 1
    },
    "ops": [
      {
        "kind": "registry",
        "hive": "HKCU",
        "path": "Software\\Microsoft\\Windows\\CurrentVersion\\Search",
        "name": "SearchboxTaskbarMode",
        "valueKind": "DWord",
        "value": "1"
      }
    ]
  },
  {
    "id": "taskbar.hide-task-view",
    "title": "Ocultar vista de tareas",
    "description": "ShowTaskViewButton=0. Preferencia de escritorio, no un boost.",
    "category": "taskbar",
    "risk": "LOW",
    "evidence": "STRONG",
    "evidenceRefs": [],
    "minBuild": 22000,
    "editions": [
      "*"
    ],
    "profiles": [
      "gaming"
    ],
    "requires": [],
    "conflicts": [],
    "requiresReboot": false,
    "affectsSecurity": false,
    "affectsUpdates": false,
    "affectsCompatibility": false,
    "detect": {
      "kind": "registry",
      "hive": "HKCU",
      "path": "Software\\Microsoft\\Windows\\CurrentVersion\\Explorer\\Advanced",
      "name": "ShowTaskViewButton",
      "valueKind": "DWord",
      "defaultIfAbsent": 1
    },
    "desired": {
      "equals": 0
    },
    "ops": [
      {
        "kind": "registry",
        "hive": "HKCU",
        "path": "Software\\Microsoft\\Windows\\CurrentVersion\\Explorer\\Advanced",
        "name": "ShowTaskViewButton",
        "valueKind": "DWord",
        "value": "0"
      }
    ]
  },
  {
    "id": "taskbar.widgets-off",
    "title": "Ocultar Widgets en la barra",
    "description": "TaskbarDa=0 quita el botón Widgets.",
    "category": "taskbar",
    "risk": "LOW",
    "evidence": "STRONG",
    "evidenceRefs": [],
    "minBuild": 22000,
    "editions": [
      "*"
    ],
    "profiles": [
      "gaming",
      "developer",
      "balanced"
    ],
    "requires": [],
    "conflicts": [],
    "requiresReboot": false,
    "affectsSecurity": false,
    "affectsUpdates": false,
    "affectsCompatibility": false,
    "detect": {
      "kind": "registry",
      "hive": "HKCU",
      "path": "Software\\Microsoft\\Windows\\CurrentVersion\\Explorer\\Advanced",
      "name": "TaskbarDa",
      "valueKind": "DWord",
      "defaultIfAbsent": 1
    },
    "desired": {
      "equals": 0
    },
    "ops": [
      {
        "kind": "registry",
        "hive": "HKCU",
        "path": "Software\\Microsoft\\Windows\\CurrentVersion\\Explorer\\Advanced",
        "name": "TaskbarDa",
        "valueKind": "DWord",
        "value": "0"
      }
    ]
  },
  {
    "id": "taskbar.alignment-left",
    "title": "Alinear la barra a la izquierda",
    "description": "TaskbarAl=0. Solo se recomienda en perfil developer; no es más rápido.",
    "category": "taskbar",
    "risk": "LOW",
    "evidence": "STRONG",
    "evidenceRefs": [],
    "minBuild": 22000,
    "editions": [
      "*"
    ],
    "profiles": [
      "developer",
      "balanced",
      "gaming"
    ],
    "requires": [],
    "conflicts": [],
    "requiresReboot": false,
    "affectsSecurity": false,
    "affectsUpdates": false,
    "affectsCompatibility": false,
    "detect": {
      "kind": "registry",
      "hive": "HKCU",
      "path": "Software\\Microsoft\\Windows\\CurrentVersion\\Explorer\\Advanced",
      "name": "TaskbarAl",
      "valueKind": "DWord",
      "defaultIfAbsent": 1
    },
    "desired": {
      "equals": 0
    },
    "ops": [
      {
        "kind": "registry",
        "hive": "HKCU",
        "path": "Software\\Microsoft\\Windows\\CurrentVersion\\Explorer\\Advanced",
        "name": "TaskbarAl",
        "valueKind": "DWord",
        "value": "0"
      }
    ]
  },
  {
    "id": "taskbar.combine-when-full",
    "title": "Combinar botones de la barra cuando esté llena",
    "description": "TaskbarGlomLevel=1.",
    "category": "taskbar",
    "risk": "LOW",
    "evidence": "STRONG",
    "evidenceRefs": [],
    "minBuild": 22000,
    "editions": [
      "*"
    ],
    "profiles": [
      "developer",
      "balanced",
      "gaming"
    ],
    "requires": [],
    "conflicts": [],
    "requiresReboot": false,
    "affectsSecurity": false,
    "affectsUpdates": false,
    "affectsCompatibility": false,
    "detect": {
      "kind": "registry",
      "hive": "HKCU",
      "path": "Software\\Microsoft\\Windows\\CurrentVersion\\Explorer\\Advanced",
      "name": "TaskbarGlomLevel",
      "valueKind": "DWord",
      "defaultIfAbsent": 0
    },
    "desired": {
      "equals": 1
    },
    "ops": [
      {
        "kind": "registry",
        "hive": "HKCU",
        "path": "Software\\Microsoft\\Windows\\CurrentVersion\\Explorer\\Advanced",
        "name": "TaskbarGlomLevel",
        "valueKind": "DWord",
        "value": "1"
      }
    ]
  },
  {
    "id": "taskbar.multi-monitor-all",
    "title": "Mostrar barra en todos los monitores",
    "description": "MMTaskbarEnabled=1.",
    "category": "taskbar",
    "risk": "LOW",
    "evidence": "STRONG",
    "evidenceRefs": [],
    "minBuild": 22000,
    "editions": [
      "*"
    ],
    "profiles": [
      "gaming",
      "developer"
    ],
    "requires": [],
    "conflicts": [],
    "requiresReboot": false,
    "affectsSecurity": false,
    "affectsUpdates": false,
    "affectsCompatibility": false,
    "detect": {
      "kind": "registry",
      "hive": "HKCU",
      "path": "Software\\Microsoft\\Windows\\CurrentVersion\\Explorer\\Advanced",
      "name": "MMTaskbarEnabled",
      "valueKind": "DWord",
      "defaultIfAbsent": 1
    },
    "desired": {
      "equals": 1
    },
    "ops": [
      {
        "kind": "registry",
        "hive": "HKCU",
        "path": "Software\\Microsoft\\Windows\\CurrentVersion\\Explorer\\Advanced",
        "name": "MMTaskbarEnabled",
        "valueKind": "DWord",
        "value": "1"
      }
    ]
  },
  {
    "id": "taskbar.end-task",
    "title": "Finalizar tarea desde la barra (dev)",
    "description": "TaskbarDeveloperSettings / EndTask. Útil en desarrollo.",
    "category": "taskbar",
    "risk": "LOW",
    "evidence": "COMMUNITY",
    "evidenceRefs": [],
    "minBuild": 22621,
    "editions": [
      "*"
    ],
    "profiles": [
      "developer",
      "balanced",
      "gaming"
    ],
    "requires": [
      "toolchain.git"
    ],
    "conflicts": [],
    "requiresReboot": false,
    "affectsSecurity": false,
    "affectsUpdates": false,
    "affectsCompatibility": false,
    "detect": {
      "kind": "registry",
      "hive": "HKCU",
      "path": "Software\\Microsoft\\Windows\\CurrentVersion\\Explorer\\Advanced\\TaskbarDeveloperSettings",
      "name": "TaskbarEndTask",
      "valueKind": "DWord",
      "defaultIfAbsent": 0
    },
    "desired": {
      "equals": 1
    },
    "ops": [
      {
        "kind": "registry",
        "hive": "HKCU",
        "path": "Software\\Microsoft\\Windows\\CurrentVersion\\Explorer\\Advanced\\TaskbarDeveloperSettings",
        "name": "TaskbarEndTask",
        "valueKind": "DWord",
        "value": "1"
      }
    ]
  }
]
