[
  {
    "id": "privacy.activity-history-off",
    "title": "Historial de actividad: no publicar/subir",
    "description": "Políticas EnableActivityFeed/Publish/Upload=0. HKLM: requiere apply de sistema (D020). No toca clipboard history de forma agresiva.",
    "category": "privacy",
    "risk": "LOW",
    "evidence": "OFFICIAL",
    "evidenceRefs": [
      "https://learn.microsoft.com/windows/privacy/windows-diagnostic-data"
    ],
    "minBuild": 22000,
    "editions": [
      "*"
    ],
    "profiles": [
      "balanced",
      "developer",
      "gaming"
    ],
    "requires": [],
    "conflicts": [],
    "requiresReboot": false,
    "affectsSecurity": false,
    "affectsUpdates": false,
    "affectsCompatibility": false,
    "detect": {
      "kind": "registry",
      "hive": "HKLM",
      "path": "SOFTWARE\\Policies\\Microsoft\\Windows\\System",
      "name": "PublishUserActivities",
      "valueKind": "DWord"
    },
    "desired": {
      "equals": 0
    },
    "ops": [
      {
        "kind": "registry",
        "hive": "HKLM",
        "path": "SOFTWARE\\Policies\\Microsoft\\Windows\\System",
        "name": "EnableActivityFeed",
        "valueKind": "DWord",
        "value": "0"
      },
      {
        "kind": "registry",
        "hive": "HKLM",
        "path": "SOFTWARE\\Policies\\Microsoft\\Windows\\System",
        "name": "PublishUserActivities",
        "valueKind": "DWord",
        "value": "0"
      },
      {
        "kind": "registry",
        "hive": "HKLM",
        "path": "SOFTWARE\\Policies\\Microsoft\\Windows\\System",
        "name": "UploadUserActivities",
        "valueKind": "DWord",
        "value": "0"
      }
    ]
  },
  {
    "id": "privacy.bing-search-off",
    "title": "Buscar en Inicio: sin Bing web",
    "description": "BingSearchEnabled=0. Deja la búsqueda local; quita resultados web de Bing en el cuadro de búsqueda.",
    "category": "privacy",
    "risk": "LOW",
    "evidence": "STRONG",
    "evidenceRefs": [],
    "minBuild": 22000,
    "editions": [
      "*"
    ],
    "profiles": [
      "balanced",
      "developer",
      "gaming"
    ],
    "requires": [],
    "conflicts": [],
    "requiresReboot": false,
    "affectsSecurity": false,
    "affectsUpdates": false,
    "affectsCompatibility": false,
    "detect": {
      "kind": "registry",
      "hive": "HKCU",
      "path": "Software\\Microsoft\\Windows\\CurrentVersion\\Search",
      "name": "BingSearchEnabled",
      "valueKind": "DWord",
      "defaultIfAbsent": 1
    },
    "desired": {
      "equals": 0
    },
    "ops": [
      {
        "kind": "registry",
        "hive": "HKCU",
        "path": "Software\\Microsoft\\Windows\\CurrentVersion\\Search",
        "name": "BingSearchEnabled",
        "valueKind": "DWord",
        "value": "0"
      }
    ]
  },
  {
    "id": "privacy.consumer-features-off",
    "title": "Consumer Features / apps promocionadas off",
    "description": "DisableWindowsConsumerFeatures=1. Menos installs sugeridos de Store. HKLM: D020.",
    "category": "privacy",
    "risk": "LOW",
    "evidence": "OFFICIAL",
    "evidenceRefs": [
      "https://learn.microsoft.com/windows/client-management/mdm/policy-csp-experience"
    ],
    "minBuild": 22000,
    "editions": [
      "*"
    ],
    "profiles": [
      "balanced",
      "developer"
    ],
    "requires": [],
    "conflicts": [],
    "requiresReboot": false,
    "affectsSecurity": false,
    "affectsUpdates": false,
    "affectsCompatibility": false,
    "detect": {
      "kind": "registry",
      "hive": "HKLM",
      "path": "SOFTWARE\\Policies\\Microsoft\\Windows\\CloudContent",
      "name": "DisableWindowsConsumerFeatures",
      "valueKind": "DWord"
    },
    "desired": {
      "equals": 1
    },
    "ops": [
      {
        "kind": "registry",
        "hive": "HKLM",
        "path": "SOFTWARE\\Policies\\Microsoft\\Windows\\CloudContent",
        "name": "DisableWindowsConsumerFeatures",
        "valueKind": "DWord",
        "value": "1"
      }
    ]
  },
  {
    "id": "privacy.background-apps-off",
    "title": "Apps en segundo plano (Store) desactivadas",
    "description": "GlobalUserDisabled=1 en BackgroundAccessApplications. COMMUNITY; puede afectar tiles/notificaciones de UWP.",
    "category": "privacy",
    "risk": "MEDIUM",
    "evidence": "COMMUNITY",
    "evidenceRefs": [],
    "minBuild": 22000,
    "editions": [
      "*"
    ],
    "profiles": [
      "gaming",
      "balanced"
    ],
    "requires": [],
    "conflicts": [],
    "requiresReboot": false,
    "affectsSecurity": false,
    "affectsUpdates": false,
    "affectsCompatibility": true,
    "detect": {
      "kind": "registry",
      "hive": "HKCU",
      "path": "Software\\Microsoft\\Windows\\CurrentVersion\\BackgroundAccessApplications",
      "name": "GlobalUserDisabled",
      "valueKind": "DWord",
      "defaultIfAbsent": 0
    },
    "desired": {
      "equals": 1
    },
    "ops": [
      {
        "kind": "registry",
        "hive": "HKCU",
        "path": "Software\\Microsoft\\Windows\\CurrentVersion\\BackgroundAccessApplications",
        "name": "GlobalUserDisabled",
        "valueKind": "DWord",
        "value": "1"
      }
    ]
  }
]
