[
  {
    "id": "gaming.game-mode-on",
    "title": "Modo Juego activado",
    "description": "AutoGameModeEnabled=1. Ajuste oficial de Windows, no garantiza FPS.",
    "category": "gaming",
    "risk": "LOW",
    "evidence": "OFFICIAL",
    "evidenceRefs": [
      "https://support.microsoft.com/windows/game-mode-and-game-bar"
    ],
    "minBuild": 22000,
    "editions": [
      "*"
    ],
    "profiles": [
      "gaming"
    ],
    "requires": [],
    "conflicts": [],
    "requiresReboot": false,
    "affectsSecurity": false,
    "affectsUpdates": false,
    "affectsCompatibility": false,
    "detect": {
      "kind": "registry",
      "hive": "HKCU",
      "path": "Software\\Microsoft\\GameBar",
      "name": "AutoGameModeEnabled",
      "valueKind": "DWord",
      "defaultIfAbsent": 1
    },
    "desired": {
      "equals": 1
    },
    "ops": [
      {
        "kind": "registry",
        "hive": "HKCU",
        "path": "Software\\Microsoft\\GameBar",
        "name": "AutoGameModeEnabled",
        "valueKind": "DWord",
        "value": "1"
      },
      {
        "kind": "registry",
        "hive": "HKCU",
        "path": "Software\\Microsoft\\GameBar",
        "name": "AllowAutoGameMode",
        "valueKind": "DWord",
        "value": "1"
      }
    ]
  },
  {
    "id": "gaming.game-dvr-off",
    "title": "Game DVR / captura en segundo plano off",
    "description": "AppCaptureEnabled=0 y GameDVR_Enabled=0. COMMUNITY: puede reducir overhead; no se afirma FPS.",
    "category": "gaming",
    "risk": "LOW",
    "evidence": "COMMUNITY",
    "evidenceRefs": [],
    "minBuild": 22000,
    "editions": [
      "*"
    ],
    "profiles": [
      "gaming"
    ],
    "requires": [],
    "conflicts": [],
    "requiresReboot": false,
    "affectsSecurity": false,
    "affectsUpdates": false,
    "affectsCompatibility": true,
    "detect": {
      "kind": "registry",
      "hive": "HKCU",
      "path": "Software\\Microsoft\\Windows\\CurrentVersion\\GameDVR",
      "name": "AppCaptureEnabled",
      "valueKind": "DWord",
      "defaultIfAbsent": 1
    },
    "desired": {
      "equals": 0
    },
    "ops": [
      {
        "kind": "registry",
        "hive": "HKCU",
        "path": "Software\\Microsoft\\Windows\\CurrentVersion\\GameDVR",
        "name": "AppCaptureEnabled",
        "valueKind": "DWord",
        "value": "0"
      },
      {
        "kind": "registry",
        "hive": "HKCU",
        "path": "System\\GameDVR",
        "name": "GameDVR_Enabled",
        "valueKind": "DWord",
        "value": "0"
      }
    ]
  },
  {
    "id": "gaming.hags-on",
    "title": "Programación de GPU acelerada por hardware (HAGS)",
    "description": "HwSchMode=2. COMMUNITY; requiere GPU reciente. No recomendado por defecto.",
    "category": "gaming",
    "risk": "MEDIUM",
    "evidence": "COMMUNITY",
    "evidenceRefs": [
      "https://devblogs.microsoft.com/directx/hardware-accelerated-gpu-scheduling/"
    ],
    "minBuild": 22000,
    "editions": [
      "*"
    ],
    "profiles": [
      "gaming"
    ],
    "requires": [
      "gpu.vendor=NVIDIA"
    ],
    "conflicts": [],
    "requiresReboot": true,
    "affectsSecurity": false,
    "affectsUpdates": false,
    "affectsCompatibility": true,
    "detect": {
      "kind": "registry",
      "hive": "HKLM",
      "path": "SYSTEM\\CurrentControlSet\\Control\\GraphicsDrivers",
      "name": "HwSchMode",
      "valueKind": "DWord",
      "defaultIfAbsent": 1
    },
    "desired": {
      "equals": 2
    },
    "ops": [
      {
        "kind": "registry",
        "hive": "HKLM",
        "path": "SYSTEM\\CurrentControlSet\\Control\\GraphicsDrivers",
        "name": "HwSchMode",
        "valueKind": "DWord",
        "value": "2"
      }
    ]
  },
  {
    "id": "gaming.gamebar-tips-off",
    "title": "No mostrar consejos de Game Bar",
    "description": "ShowStartupPanel=0.",
    "category": "gaming",
    "risk": "LOW",
    "evidence": "STRONG",
    "evidenceRefs": [],
    "minBuild": 22000,
    "editions": [
      "*"
    ],
    "profiles": [
      "gaming"
    ],
    "requires": [],
    "conflicts": [],
    "requiresReboot": false,
    "affectsSecurity": false,
    "affectsUpdates": false,
    "affectsCompatibility": false,
    "detect": {
      "kind": "registry",
      "hive": "HKCU",
      "path": "Software\\Microsoft\\GameBar",
      "name": "ShowStartupPanel",
      "valueKind": "DWord",
      "defaultIfAbsent": 1
    },
    "desired": {
      "equals": 0
    },
    "ops": [
      {
        "kind": "registry",
        "hive": "HKCU",
        "path": "Software\\Microsoft\\GameBar",
        "name": "ShowStartupPanel",
        "valueKind": "DWord",
        "value": "0"
      }
    ]
  },
  {
    "id": "gaming.mouse-accel-off",
    "title": "Aceleración del ratón desactivada",
    "description": "MouseSpeed/Thresholds=0 (puntero 1:1). Preferido en muchos juegos; no es un boost de FPS.",
    "category": "gaming",
    "risk": "LOW",
    "evidence": "COMMUNITY",
    "evidenceRefs": [],
    "minBuild": 22000,
    "editions": [
      "*"
    ],
    "profiles": [
      "gaming"
    ],
    "requires": [],
    "conflicts": [],
    "requiresReboot": false,
    "affectsSecurity": false,
    "affectsUpdates": false,
    "affectsCompatibility": true,
    "detect": {
      "kind": "registry",
      "hive": "HKCU",
      "path": "Control Panel\\Mouse",
      "name": "MouseSpeed",
      "valueKind": "String",
      "defaultIfAbsent": "1"
    },
    "desired": {
      "equals": "0"
    },
    "ops": [
      {
        "kind": "registry",
        "hive": "HKCU",
        "path": "Control Panel\\Mouse",
        "name": "MouseSpeed",
        "valueKind": "String",
        "value": "0"
      },
      {
        "kind": "registry",
        "hive": "HKCU",
        "path": "Control Panel\\Mouse",
        "name": "MouseThreshold1",
        "valueKind": "String",
        "value": "0"
      },
      {
        "kind": "registry",
        "hive": "HKCU",
        "path": "Control Panel\\Mouse",
        "name": "MouseThreshold2",
        "valueKind": "String",
        "value": "0"
      }
    ]
  }
]
