[
  {
    "id": "explorer.show-file-extensions",
    "title": "Mostrar extensiones de archivo",
    "description": "HideFileExt=0 muestra .exe/.msix en el Explorador. Documentado como opción de carpeta.",
    "category": "explorer",
    "risk": "LOW",
    "evidence": "OFFICIAL",
    "evidenceRefs": [
      "https://learn.microsoft.com/windows/win32/shell/folder-options"
    ],
    "minBuild": 22000,
    "editions": [
      "*"
    ],
    "profiles": [
      "balanced",
      "developer"
    ],
    "requires": [],
    "conflicts": [],
    "requiresReboot": false,
    "affectsSecurity": false,
    "affectsUpdates": false,
    "affectsCompatibility": false,
    "detect": {
      "kind": "registry",
      "hive": "HKCU",
      "path": "Software\\Microsoft\\Windows\\CurrentVersion\\Explorer\\Advanced",
      "name": "HideFileExt",
      "valueKind": "DWord",
      "defaultIfAbsent": 1
    },
    "desired": {
      "equals": 0
    },
    "ops": [
      {
        "kind": "registry",
        "hive": "HKCU",
        "path": "Software\\Microsoft\\Windows\\CurrentVersion\\Explorer\\Advanced",
        "name": "HideFileExt",
        "valueKind": "DWord",
        "value": "0"
      }
    ]
  },
  {
    "id": "explorer.show-hidden-files",
    "title": "Mostrar archivos ocultos",
    "description": "Hidden=1 muestra archivos con atributo Hidden.",
    "category": "explorer",
    "risk": "LOW",
    "evidence": "OFFICIAL",
    "evidenceRefs": [
      "https://learn.microsoft.com/windows/win32/shell/folder-options"
    ],
    "minBuild": 22000,
    "editions": [
      "*"
    ],
    "profiles": [
      "developer"
    ],
    "requires": [],
    "conflicts": [],
    "requiresReboot": false,
    "affectsSecurity": false,
    "affectsUpdates": false,
    "affectsCompatibility": false,
    "detect": {
      "kind": "registry",
      "hive": "HKCU",
      "path": "Software\\Microsoft\\Windows\\CurrentVersion\\Explorer\\Advanced",
      "name": "Hidden",
      "valueKind": "DWord",
      "defaultIfAbsent": 2
    },
    "desired": {
      "equals": 1
    },
    "ops": [
      {
        "kind": "registry",
        "hive": "HKCU",
        "path": "Software\\Microsoft\\Windows\\CurrentVersion\\Explorer\\Advanced",
        "name": "Hidden",
        "valueKind": "DWord",
        "value": "1"
      }
    ]
  },
  {
    "id": "explorer.launch-this-pc",
    "title": "Abrir el Explorador en Este equipo",
    "description": "LaunchTo=1 abre Este equipo en lugar de Inicio.",
    "category": "explorer",
    "risk": "LOW",
    "evidence": "STRONG",
    "evidenceRefs": [
      "https://learn.microsoft.com/windows/win32/shell/folder-options"
    ],
    "minBuild": 22000,
    "editions": [
      "*"
    ],
    "profiles": [
      "developer",
      "balanced"
    ],
    "requires": [],
    "conflicts": [],
    "requiresReboot": false,
    "affectsSecurity": false,
    "affectsUpdates": false,
    "affectsCompatibility": false,
    "detect": {
      "kind": "registry",
      "hive": "HKCU",
      "path": "Software\\Microsoft\\Windows\\CurrentVersion\\Explorer\\Advanced",
      "name": "LaunchTo",
      "valueKind": "DWord"
    },
    "desired": {
      "equals": 1
    },
    "ops": [
      {
        "kind": "registry",
        "hive": "HKCU",
        "path": "Software\\Microsoft\\Windows\\CurrentVersion\\Explorer\\Advanced",
        "name": "LaunchTo",
        "valueKind": "DWord",
        "value": "1"
      }
    ]
  },
  {
    "id": "explorer.compact-mode",
    "title": "Modo compacto del Explorador",
    "description": "UseCompactMode reduce el padding de la lista de archivos (Windows 11).",
    "category": "explorer",
    "risk": "LOW",
    "evidence": "STRONG",
    "evidenceRefs": [],
    "minBuild": 22000,
    "editions": [
      "*"
    ],
    "profiles": [
      "developer"
    ],
    "requires": [],
    "conflicts": [],
    "requiresReboot": false,
    "affectsSecurity": false,
    "affectsUpdates": false,
    "affectsCompatibility": false,
    "detect": {
      "kind": "registry",
      "hive": "HKCU",
      "path": "Software\\Microsoft\\Windows\\CurrentVersion\\Explorer\\Advanced",
      "name": "UseCompactMode",
      "valueKind": "DWord",
      "defaultIfAbsent": 0
    },
    "desired": {
      "equals": 1
    },
    "ops": [
      {
        "kind": "registry",
        "hive": "HKCU",
        "path": "Software\\Microsoft\\Windows\\CurrentVersion\\Explorer\\Advanced",
        "name": "UseCompactMode",
        "valueKind": "DWord",
        "value": "1"
      }
    ]
  },
  {
    "id": "explorer.show-full-path",
    "title": "Mostrar ruta completa en la barra de título",
    "description": "DisplayFullPath en CabinetState.",
    "category": "explorer",
    "risk": "LOW",
    "evidence": "STRONG",
    "evidenceRefs": [],
    "minBuild": 22000,
    "editions": [
      "*"
    ],
    "profiles": [
      "developer"
    ],
    "requires": [],
    "conflicts": [],
    "requiresReboot": false,
    "affectsSecurity": false,
    "affectsUpdates": false,
    "affectsCompatibility": false,
    "detect": {
      "kind": "registry",
      "hive": "HKCU",
      "path": "Software\\Microsoft\\Windows\\CurrentVersion\\Explorer\\CabinetState",
      "name": "FullPath",
      "valueKind": "DWord",
      "defaultIfAbsent": 0
    },
    "desired": {
      "equals": 1
    },
    "ops": [
      {
        "kind": "registry",
        "hive": "HKCU",
        "path": "Software\\Microsoft\\Windows\\CurrentVersion\\Explorer\\CabinetState",
        "name": "FullPath",
        "valueKind": "DWord",
        "value": "1"
      }
    ]
  },
  {
    "id": "explorer.hide-protected-os-files",
    "title": "Ocultar archivos protegidos del sistema (recomendado)",
    "description": "ShowSuperHidden=0 evita mostrar archivos de sistema críticos por accidente.",
    "category": "explorer",
    "risk": "LOW",
    "evidence": "OFFICIAL",
    "evidenceRefs": [
      "https://learn.microsoft.com/windows/win32/shell/folder-options"
    ],
    "minBuild": 22000,
    "editions": [
      "*"
    ],
    "profiles": [
      "balanced"
    ],
    "requires": [],
    "conflicts": [],
    "requiresReboot": false,
    "affectsSecurity": true,
    "affectsUpdates": false,
    "affectsCompatibility": false,
    "detect": {
      "kind": "registry",
      "hive": "HKCU",
      "path": "Software\\Microsoft\\Windows\\CurrentVersion\\Explorer\\Advanced",
      "name": "ShowSuperHidden",
      "valueKind": "DWord",
      "defaultIfAbsent": 0
    },
    "desired": {
      "equals": 0
    },
    "ops": [
      {
        "kind": "registry",
        "hive": "HKCU",
        "path": "Software\\Microsoft\\Windows\\CurrentVersion\\Explorer\\Advanced",
        "name": "ShowSuperHidden",
        "valueKind": "DWord",
        "value": "0"
      }
    ]
  },
  {
    "id": "explorer.hide-frequent-quick-access",
    "title": "Acceso rápido: ocultar frecuentes",
    "description": "ShowFrequent=0. Menos historial de carpetas en el panel izquierdo.",
    "category": "explorer",
    "risk": "LOW",
    "evidence": "STRONG",
    "evidenceRefs": [],
    "minBuild": 22000,
    "editions": [
      "*"
    ],
    "profiles": [
      "balanced",
      "developer",
      "gaming"
    ],
    "requires": [],
    "conflicts": [],
    "requiresReboot": false,
    "affectsSecurity": false,
    "affectsUpdates": false,
    "affectsCompatibility": false,
    "detect": {
      "kind": "registry",
      "hive": "HKCU",
      "path": "Software\\Microsoft\\Windows\\CurrentVersion\\Explorer",
      "name": "ShowFrequent",
      "valueKind": "DWord",
      "defaultIfAbsent": 1
    },
    "desired": {
      "equals": 0
    },
    "ops": [
      {
        "kind": "registry",
        "hive": "HKCU",
        "path": "Software\\Microsoft\\Windows\\CurrentVersion\\Explorer",
        "name": "ShowFrequent",
        "valueKind": "DWord",
        "value": "0"
      }
    ]
  },
  {
    "id": "explorer.hide-recent-quick-access",
    "title": "Acceso rápido: ocultar recientes",
    "description": "ShowRecent=0. Fija carpetas a mano.",
    "category": "explorer",
    "risk": "LOW",
    "evidence": "STRONG",
    "evidenceRefs": [],
    "minBuild": 22000,
    "editions": [
      "*"
    ],
    "profiles": [
      "balanced",
      "developer",
      "gaming"
    ],
    "requires": [],
    "conflicts": [],
    "requiresReboot": false,
    "affectsSecurity": false,
    "affectsUpdates": false,
    "affectsCompatibility": false,
    "detect": {
      "kind": "registry",
      "hive": "HKCU",
      "path": "Software\\Microsoft\\Windows\\CurrentVersion\\Explorer",
      "name": "ShowRecent",
      "valueKind": "DWord",
      "defaultIfAbsent": 1
    },
    "desired": {
      "equals": 0
    },
    "ops": [
      {
        "kind": "registry",
        "hive": "HKCU",
        "path": "Software\\Microsoft\\Windows\\CurrentVersion\\Explorer",
        "name": "ShowRecent",
        "valueKind": "DWord",
        "value": "0"
      }
    ]
  }
]
