[
  {
    "id": "gaming.xbox-auth-disabled",
    "title": "Xbox Identity Provider (XblAuthManager) off",
    "description": "Start=4. Libera un servicio Xbox en idle cuando teletrabajas o usas VMs. Puede romper inicio de sesión Xbox / Game Bar. No toca DiagTrack/SysMain/WSearch. Requiere apply de sistema (D020). COMMUNITY: no se afirma ganancia de FPS.",
    "category": "gaming",
    "risk": "MEDIUM",
    "evidence": "COMMUNITY",
    "evidenceRefs": [],
    "minBuild": 22000,
    "editions": [
      "*"
    ],
    "profiles": [
      "virtualization",
      "developer"
    ],
    "requires": [],
    "conflicts": [],
    "requiresReboot": false,
    "affectsSecurity": false,
    "affectsUpdates": false,
    "affectsCompatibility": true,
    "detect": {
      "kind": "registry",
      "hive": "HKLM",
      "path": "SYSTEM\\CurrentControlSet\\Services\\XblAuthManager",
      "name": "Start",
      "valueKind": "DWord"
    },
    "desired": {
      "equals": "4"
    },
    "ops": [
      {
        "kind": "service",
        "name": "XblAuthManager",
        "value": "disabled"
      }
    ]
  },
  {
    "id": "gaming.xbox-net-api-disabled",
    "title": "Xbox Networking (XboxNetApiSvc) off",
    "description": "Start=4. Servicio de red Xbox; útil pausarlo fuera de juegos/online. Puede afectar multiplayer Xbox / Game Pass. Apply de sistema (D020).",
    "category": "gaming",
    "risk": "MEDIUM",
    "evidence": "COMMUNITY",
    "evidenceRefs": [],
    "minBuild": 22000,
    "editions": [
      "*"
    ],
    "profiles": [
      "virtualization",
      "developer"
    ],
    "requires": [],
    "conflicts": [],
    "requiresReboot": false,
    "affectsSecurity": false,
    "affectsUpdates": false,
    "affectsCompatibility": true,
    "detect": {
      "kind": "registry",
      "hive": "HKLM",
      "path": "SYSTEM\\CurrentControlSet\\Services\\XboxNetApiSvc",
      "name": "Start",
      "valueKind": "DWord"
    },
    "desired": {
      "equals": "4"
    },
    "ops": [
      {
        "kind": "service",
        "name": "XboxNetApiSvc",
        "value": "disabled"
      }
    ]
  },
  {
    "id": "gaming.xbox-game-save-disabled",
    "title": "Xbox Game Save (XblGameSave) off",
    "description": "Start=4. Guardado en la nube Xbox. Pausar en modo trabajo/VM; reactivar para Game Pass / sync. Apply de sistema (D020).",
    "category": "gaming",
    "risk": "MEDIUM",
    "evidence": "COMMUNITY",
    "evidenceRefs": [],
    "minBuild": 22000,
    "editions": [
      "*"
    ],
    "profiles": [
      "virtualization",
      "developer"
    ],
    "requires": [],
    "conflicts": [],
    "requiresReboot": false,
    "affectsSecurity": false,
    "affectsUpdates": false,
    "affectsCompatibility": true,
    "detect": {
      "kind": "registry",
      "hive": "HKLM",
      "path": "SYSTEM\\CurrentControlSet\\Services\\XblGameSave",
      "name": "Start",
      "valueKind": "DWord"
    },
    "desired": {
      "equals": "4"
    },
    "ops": [
      {
        "kind": "service",
        "name": "XblGameSave",
        "value": "disabled"
      }
    ]
  },
  {
    "id": "gaming.gaming-services-disabled",
    "title": "Microsoft Gaming Services off",
    "description": "Start=4 en GamingServices. Núcleo de Xbox apps / algunos títulos Store. Solo para modos trabajo/VM intensivos; rompe Game Bar y varios juegos Store. Apply de sistema (D020). No recomendado en perfil gaming.",
    "category": "gaming",
    "risk": "HIGH",
    "evidence": "COMMUNITY",
    "evidenceRefs": [],
    "minBuild": 22000,
    "editions": [
      "*"
    ],
    "profiles": [
      "virtualization",
      "developer"
    ],
    "requires": [],
    "conflicts": [],
    "requiresReboot": false,
    "affectsSecurity": false,
    "affectsUpdates": false,
    "affectsCompatibility": true,
    "detect": {
      "kind": "registry",
      "hive": "HKLM",
      "path": "SYSTEM\\CurrentControlSet\\Services\\GamingServices",
      "name": "Start",
      "valueKind": "DWord"
    },
    "desired": {
      "equals": "4"
    },
    "ops": [
      {
        "kind": "service",
        "name": "GamingServices",
        "value": "disabled"
      }
    ]
  },
  {
    "id": "gaming.gaming-services-net-disabled",
    "title": "Gaming Services Net off",
    "description": "Start=4 en GamingServicesNet (compañero de Gaming Services). Mismo riesgo de compatibilidad. Apply de sistema (D020).",
    "category": "gaming",
    "risk": "HIGH",
    "evidence": "COMMUNITY",
    "evidenceRefs": [],
    "minBuild": 22000,
    "editions": [
      "*"
    ],
    "profiles": [
      "virtualization",
      "developer"
    ],
    "requires": [],
    "conflicts": [],
    "requiresReboot": false,
    "affectsSecurity": false,
    "affectsUpdates": false,
    "affectsCompatibility": true,
    "detect": {
      "kind": "registry",
      "hive": "HKLM",
      "path": "SYSTEM\\CurrentControlSet\\Services\\GamingServicesNet",
      "name": "Start",
      "valueKind": "DWord"
    },
    "desired": {
      "equals": "4"
    },
    "ops": [
      {
        "kind": "service",
        "name": "GamingServicesNet",
        "value": "disabled"
      }
    ]
  }
]
